{
  "schema_version": "1.0.0",
  "id": "asset-audio-001",
  "source_id": "source-audio-001",
  "uri": "crp-ref://default/assets/asset-audio-001",
  "content_hash": "2222222222222222222222222222222222222222222222222222222222222222",
  "size_bytes": 8192,
  "media_type": "audio/mpeg",
  "storage_mode": "reference",
  "availability": "missing",
  "availability_reason": "platform_reference_not_found",
  "created_at": "2026-06-29T13:05:00Z",
  "verified_at": "2026-06-29T13:10:00Z",
  "metadata": {
    "display_name": "meeting.mp3"
  }
}
